{
  "schema_version": "1.0",
  "id": "performance_v1",
  "claim_scope": "computational_performance_only",
  "protocol": {
    "output_profile": "full",
    "inference_cache": "disabled",
    "concurrency": "one_logical_execution_at_a_time",
    "repetition_semantics": "same_algorithm_seed_independent_system_repetitions",
    "order_algorithm": "sha256_rank_rotate_reverse_v1",
    "order_salt": "spathi-performance-counterbalance-v1",
    "measurement_source": "run_report.execution.measurement",
    "measurement_scope": "andrea_execution",
    "wall_time_semantics": "andrea_execution_end_to_end_including_input_verification_preparation_scheduling_merging_and_requested_output_materialization",
    "memory_measurement_source": "run_report.execution.measurement.peak_memory_bytes",
    "memory_measurement_semantics": "overlap_upper_bound_from_physical_container_peaks_excludes_andrea_host_process",
    "io_measurement": "unavailable_in_andrea_v1_output_bytes_only"
  },
  "budgets": {
    "reduced": {
      "profile_id": "performance-reduced",
      "catalog_request": "experiments/v1/inference/group_only/reduced-primary.json",
      "catalog_metadata": "experiments/v1/inference/group_only/reduced-primary-metadata.json",
      "datasets": [
        {
          "generation_job_id": "scmultisim_performance_medium",
          "replicate_index": 1,
          "size_class": "medium"
        }
      ],
      "tools": [
        {"configuration_id": "spathi_selected", "tool_id": "spathi", "origin": "spathi_selected_policy"},
        {"configuration_id": "genie3_default", "tool_id": "genie3", "origin": "catalog"},
        {"configuration_id": "grnboost2_default", "tool_id": "grnboost2", "origin": "catalog"},
        {"configuration_id": "infercsn_none", "tool_id": "infercsn", "origin": "catalog"}
      ],
      "thread_counts": [1, 8],
      "system_repetitions": 1,
      "warmups_per_condition": 1,
      "algorithm_seed_namespace": "reduced.performance",
      "algorithm_seed_replicate_index": 1,
      "expected_measured_runs": 8,
      "expected_warmup_runs": 8
    },
    "full": {
      "profile_id": "performance-full",
      "catalog_request": "experiments/v1/inference/group_only/full-primary.json",
      "catalog_metadata": "experiments/v1/inference/group_only/full-primary-metadata.json",
      "datasets": [
        {
          "generation_job_id": "scmultisim_performance_small",
          "replicate_index": 1,
          "size_class": "small"
        },
        {
          "generation_job_id": "scmultisim_performance_medium",
          "replicate_index": 1,
          "size_class": "medium"
        }
      ],
      "tools": [
        {"configuration_id": "spathi_selected", "tool_id": "spathi", "origin": "spathi_selected_policy"},
        {"configuration_id": "aracne3_default", "tool_id": "aracne3", "origin": "catalog"},
        {"configuration_id": "genie3_default", "tool_id": "genie3", "origin": "catalog"},
        {"configuration_id": "grnboost2_default", "tool_id": "grnboost2", "origin": "catalog"},
        {"configuration_id": "infercsn_none", "tool_id": "infercsn", "origin": "catalog"},
        {"configuration_id": "tigress_default", "tool_id": "tigress", "origin": "catalog"}
      ],
      "thread_counts": [1, 2, 4, 8],
      "system_repetitions": 3,
      "warmups_per_condition": 1,
      "algorithm_seed_namespace": "full.performance",
      "algorithm_seed_replicate_index": 1,
      "expected_measured_runs": 144,
      "expected_warmup_runs": 48
    }
  }
}
